{"conflict_region_ids":["c1"],"evidence_links":[{"detail":"rule-a","id":"ast-1","line_end":2,"line_start":1,"path":"a.ts","type":"ast_match"},{"detail":"git conflict marker region","id":"c1","line_end":2,"line_start":1,"path":"z.ts","type":"conflict"},{"detail":"score=0.5000","id":"retrieval-h1","line_end":2,"line_start":1,"path":"b.ts","type":"retrieval_hit"}],"left_intent":"L","prompt_excerpt":"Intents \u2014 left: L\nIntents \u2014 right: R\nEvidence links: 3","right_intent":"R","schema":"tonic-intent-hydration","token_budget_hint":8000,"truncation_policy_version":"1","version":"1"}
